{
  "schema_version": "1.0.0",
  "lane_id": "iqs",
  "package_id": "BLIND-REVIEW-03",
  "status": "partial",
  "snapshot": {
    "repository": "C:\\Users\\郑曾波\\Projects\\iqs-blind-review-lab",
    "base_ref": "NEW_REPOSITORY_TEMPLATE_ONLY",
    "base_commit": "NEW_REPOSITORY_TEMPLATE_ONLY",
    "result_ref": "",
    "result_commit": null,
    "worktree_before": {
      "state": "clean",
      "dirty_path_count": 0,
      "manifest_sha256": null
    },
    "worktree_after": {
      "state": "clean",
      "dirty_path_count": 0,
      "manifest_sha256": null
    }
  },
  "scope": {
    "task_ids": [
      "B01",
      "L02",
      "F05"
    ],
    "authorization_scope_ref": "human_requested_independent_packages; TEMPLATE_ONLY_NOT_DISPATCHED; new_root_only",
    "owned_paths": [
      "C:\\Users\\郑曾波\\Projects\\iqs-blind-review-lab"
    ],
    "authorized_paths": [
      "README.md",
      ".gitignore",
      "pyproject.toml",
      "task_plan.md",
      "progress.md",
      "findings.md",
      "src",
      "schemas",
      "content",
      "fixtures",
      "tools",
      "tests",
      "runs",
      "docs/handoff"
    ],
    "changed_paths": [],
    "out_of_scope_writes": []
  },
  "interfaces": [],
  "verification": {
    "checks": [],
    "external_writes": false,
    "network_calls": false,
    "paid_calls": false,
    "temporary_roots": []
  },
  "review": {
    "status": "not_run",
    "snapshot_commit": null,
    "findings": []
  },
  "open_items": [
    "TEMPLATE_ONLY: no worker started or product test run.",
    "Frozen multi-repo lock is authoritative; source repositories are read-only.",
    "No financial gold, production identity, release or gate authority granted."
  ],
  "next_action": "Read card/common-rules/integration-contract; verify frozen inputs; sole writer preflight."
}
